{
 "spec_version": "0.2-draft",
 "id": "pastis-r-cropseg",
 "title": "Crop type segmentation from Sentinel-2 and Sentinel-1 time series (PASTIS-R)",
 "dataset_id": "pastis-pastis-r",
 "task_type": "semantic-segmentation",
 "data": {
  "source_url": "https://zenodo.org/record/5735646",
  "revision": "Zenodo record 5735646 (DOI 10.5281/zenodo.5735646)",
  "access": "open",
  "manifest_status": "pending"
 },
 "inputs": {
  "s2": {
   "sensor": "sentinel-2-msi",
   "product": "L2A (THEIA)",
   "quantity": "surface_reflectance",
   "required": true,
   "bands": [
    {
     "band": "B02"
    },
    {
     "band": "B03"
    },
    {
     "band": "B04"
    },
    {
     "band": "B05"
    },
    {
     "band": "B06"
    },
    {
     "band": "B07"
    },
    {
     "band": "B08"
    },
    {
     "band": "B8A"
    },
    {
     "band": "B11"
    },
    {
     "band": "B12"
    }
   ],
   "raster": {
    "stored_dtype": "int16",
    "scale": 0.0001,
    "offset": 0,
    "nodata": -10000,
    "unit": "1"
   },
   "grid": {
    "size_px": 128,
    "gsd_m": 10,
    "resampling": "all bands resampled to 10 m with bilinear interpolation (PASTIS documentation)"
   },
   "time": {
    "steps": 6,
    "selection": "calendar-windows",
    "windows": {
     "period": "2018-09-01 to 2019-10-31 (acquisitions in metadata.geojson run from 2018-09-17 to 2019-10-27)",
     "n": 6,
     "pick": "nearest-centre",
     "empty_window": "mask-invalid"
    },
    "comparison_rule": "PANGAEA: 6 acquisitions at evenly spaced indices, dates dropped"
   },
   "notes": "38–61 acquisitions per patch. No cloud mask is shipped, so 'clearest' cannot be computed; the acquisition nearest each window centre is used."
  },
  "s1_asc": {
   "sensor": "sentinel-1-iw",
   "product": "GRD",
   "quantity": "sigma0_backscatter",
   "orbit": "ascending",
   "required": true,
   "bands": [
    {
     "band": "VV"
    },
    {
     "band": "VH"
    },
    {
     "name": "VV/VH",
     "derived_from": "VV / VH ratio (whether computed in linear or dB units is not stated)"
    }
   ],
   "raster": {
    "stored_dtype": "float32",
    "scale": 1,
    "offset": 0,
    "nodata": null,
    "unit": "dB"
   },
   "grid": {
    "size_px": 128,
    "gsd_m": 10
   },
   "time": {
    "steps": 6,
    "selection": "calendar-windows",
    "windows": {
     "period": "same six windows as s2",
     "n": 6,
     "pick": "nearest-centre",
     "empty_window": "mask-invalid"
    },
    "comparison_rule": "PANGAEA: 6 acquisitions at evenly spaced indices, dates dropped"
   },
   "notes": "About 70 ascending acquisitions per patch. No speckle filtering or terrain correction (PASTIS-R paper)."
  }
 },
 "sample_metadata": {
  "location": "centroid",
  "acquisition_time": "per-step",
  "source_crs": "EPSG:2154"
 },
 "target": {
  "kind": "per-pixel-class",
  "grid": "s2",
  "classes": [
   {
    "index": 0,
    "name": "Background"
   },
   {
    "index": 1,
    "name": "Meadow"
   },
   {
    "index": 2,
    "name": "Soft Winter Wheat"
   },
   {
    "index": 3,
    "name": "Corn"
   },
   {
    "index": 4,
    "name": "Winter Barley"
   },
   {
    "index": 5,
    "name": "Winter Rapeseed"
   },
   {
    "index": 6,
    "name": "Spring Barley"
   },
   {
    "index": 7,
    "name": "Sunflower"
   },
   {
    "index": 8,
    "name": "Grapevine"
   },
   {
    "index": 9,
    "name": "Beet"
   },
   {
    "index": 10,
    "name": "Winter Triticale"
   },
   {
    "index": 11,
    "name": "Winter Durum Wheat"
   },
   {
    "index": 12,
    "name": "Fruits, Vegetables, Flowers"
   },
   {
    "index": 13,
    "name": "Potatoes"
   },
   {
    "index": 14,
    "name": "Leguminous Fodder"
   },
   {
    "index": 15,
    "name": "Soybeans"
   },
   {
    "index": 16,
    "name": "Orchard"
   },
   {
    "index": 17,
    "name": "Mixed Cereal"
   },
   {
    "index": 18,
    "name": "Sorghum"
   },
   {
    "index": 19,
    "name": "Void Label"
   }
  ],
  "ignore_index": 19,
  "label_source": "French Land Parcel Identification System (RPG) declarations",
  "notes": "Background is non-agricultural land and is scored as a class. Void marks parcels mostly outside the patch."
 },
 "splits": {
  "official": {
   "kind": "buffered-random",
   "definition": "Official 5-fold split in metadata.geojson, folds chosen 'with a 1km buffer between images' (Garnot & Landrieu 2021, §4.1) but interleaved within the same Sentinel-2 tiles; folds 1–3 train, 4 val, 5 test (as in PANGAEA pastis.py).",
   "manifests": {
    "train": {
     "path": "manifests/pastis-r-cropseg/train.csv",
     "sha256": null,
     "n_samples": 1455
    },
    "val": {
     "path": "manifests/pastis-r-cropseg/val.csv",
     "sha256": null,
     "n_samples": 482
    },
    "test": {
     "path": "manifests/pastis-r-cropseg/test.csv",
     "sha256": null,
     "n_samples": 496
    }
   },
   "test_labels_public": true
  },
  "extra_tests": [
   {
    "name": "out-of-region",
    "kind": "geographic-regions",
    "status": "proposed",
    "definition": "Hold out every patch of Sentinel-2 tile T32ULU (556 patches, the only tile in UTM zone 32); train and validate on tiles T31TFM, T31TFJ and T30UXV."
   }
  ],
  "label_fractions": {
   "fractions": [
    1.0,
    0.1,
    0.01
   ],
   "stratify_by": "majority crop class of the patch",
   "min_train_samples": 10
  }
 },
 "evaluation": {
  "primary_metric": {
   "name": "mIoU",
   "averaging": "mean of per-class IoU over the 19 scored classes, pixels pooled over the test set",
   "higher_is_better": true
  },
  "secondary_metrics": [
   {
    "name": "overall accuracy",
    "averaging": "over scored pixels",
    "higher_is_better": true
   }
  ],
  "tracks": [
   "frozen-decoder",
   "finetune"
  ],
  "diagnostics": [
   "linear-probe"
  ],
  "inference": "whole 128 × 128 patch; adapters tile or upsample per protocols.json"
 },
 "normalisation_stats": {
  "source": "PANGAEA configs/dataset/pastis.yaml, converted with the scale above",
  "computed_on": "not stated in the config",
  "per_modality": {
   "s2": {
    "mean": [
     0.116168,
     0.137143,
     0.142341,
     0.175973,
     0.271453,
     0.305584,
     0.31979,
     0.331336,
     0.241597,
     0.162684
    ],
    "std": [
     0.204507,
     0.198318,
     0.20608,
     0.196882,
     0.186722,
     0.188514,
     0.189751,
     0.188516,
     0.154277,
     0.137525
    ]
   },
   "s1_asc": {
    "mean": [
     -10.9433,
     -17.36,
     6.4167
    ],
    "std": [
     3.3847,
     3.3727,
     3.3874
    ]
   }
  }
 },
 "notes": {
  "harness": [
   "PANGAEA picks time steps by index, not by date, and returns empty metadata, so dates never reach the model (pangaea/datasets/pastis.py, __getitem__).",
   "PANGAEA uses only the ascending Sentinel-1 series; PASTIS-R also has a descending one.",
   "PANGAEA's config lists data_min of -10000 for every S2 band, so no-data pixels appear to be passed to models as values."
  ],
  "open_questions": [
   "Is nearest-centre the right pick without a cloud mask, or should S2 windows use a median composite?"
  ]
 },
 "provenance": {
  "sources": [
   {
    "label": "PASTIS benchmark README",
    "url": "https://github.com/VSainteuf/pastis-benchmark"
   },
   {
    "label": "PANGAEA dataset config",
    "url": "https://github.com/VMarsocci/pangaea-bench/blob/main/configs/dataset/pastis.yaml"
   },
   {
    "label": "PANGAEA loader",
    "url": "https://github.com/VMarsocci/pangaea-bench/blob/main/pangaea/datasets/pastis.py"
   },
   {
    "label": "PANGAEA segmentation task config",
    "url": "https://github.com/VMarsocci/pangaea-bench/blob/main/configs/task/segmentation.yaml"
   },
   {
    "label": "Garnot & Landrieu 2021 (PASTIS paper)",
    "url": "https://arxiv.org/abs/2107.07933"
   },
   {
    "label": "PASTIS documentation (PDF)",
    "url": "https://github.com/VSainteuf/pastis-benchmark/blob/main/documentation/pastis-documentation.pdf"
   },
   {
    "label": "PASTIS-R paper (Garnot et al. 2022)",
    "url": "https://arxiv.org/abs/2112.07558"
   }
  ]
 },
 "unverified": [
  "/inputs/s2/raster/scale",
  "/inputs/s2/raster/nodata",
  "/inputs/s1_asc/raster/stored_dtype",
  "/inputs/s1_asc/bands/2/derived_from",
  "/normalisation_stats/computed_on"
 ]
}